Product Title,Price
COMBO 4 EN UNO - TECLADO+MOUSE+AURICULAR+PAD MOUSE - GAMBYTE GRYPHUS-H (GI-GRYPHUS-H),$45.00 - S/173.25
COMBO 2 EN UNO - TECLADO+MOUSE - GAMBYTE MECANICO GAMER DESTROYER (GI-DESTROYER-MR),$62.00 - S/238.70
COMBO 4 EN UNO - TECLADO+MOUSE+AURICULAR+PAD MOUSE - GAMBYTE DEATHSTROKE (GI-DEATHSTROKE-MR)...,$45.50 - S/175.18
COMBO 2 EN UNO - TECLADO+MOUSE - LOGITECH MK120 (920-004428),$14.50 - S/55.83
COMBO 4 EN UNO - TECLADO+MOUSE+AURICULAR+PAD MOUSE - GAMBYTE BATTLECRUISER (GI-BATTLECRUISER-MR...,$112.00 - S/431.20
COMBO 2 EN UNO - TECLADO+MOUSE - CORSAIR K55 PRO & HARPOON PRO LED- RGB (CH-9226865-SP),$63.00 - S/242.55
"COMBO 2 EN UNO - TECLADO+MOUSE - HALION MULTIMEDIA OFFICE | (HA-K205C)",$11.50 - S/44.28
"TECLADO LOGITECH K120, DISEÑO RESISTENTE A SALPICADURAS, CONEXCION USB, COLOR NEGRO (920-00442...",$10.50 - S/40.43
COMBO 2 EN UNO - TECLADO+MOUSE - LOGITECH INALAMBRICO MK270 (920-004432),$28.50 - S/109.73
"TECLADO CYBERTEL MECANICO, GAMER COMBAT KGX1000, TECLAS ANTI-GHOSTING, CON EFECTOILUMINACION LE...",$34.00 - S/130.90
"MATESTATION S HUAWEI AMD RYZEN5 4600G ( DEHU53011VHL ) | MONITOR | TECLADO | MOUSE",$767.00 - S/2 952.95
COMBO 2 EN UNO - TECLADO+MOUSE - LOGITECH INALAMBRICO MK220 (920-004430),$19.00 - S/73.15
"TECLADO ENKORE, MECANICO GAMER KINGDOM ENK1001, SISTEMA ANTIDERRAME, CON ILUMINACIÓN LED RGB, ...",$24.50 - S/94.33
COMBO 2 EN UNO - TECLADO+MOUSE - HALION INALAMBRICO HA-K210W (HA-K210W),$17.00 - S/65.45
"TECLADO CORSAIR GAMER MECANICO K63, WIRELESS, BLUETOOTH, SWITCH ROJO, LED - AZUL (CH-9145030-SP...",$83.50 - S/321.48
"TECLADO CORSAIR GAMER MECANICO K60 PRO, USB 2.0, LED - ROJO C/TECLAS NEGRAS (CH-910D029-SP)...",$84.00 - S/323.40
"TECLADO LOGITECH GAMER MECANICO G413, RETROILUMINACIÓN CARBON LED - ROJO, 5 NIVELES DE INTENSI...",$114.00 - S/438.90
TECLADO LOGITECH GAMING MECANICO G513 CARBON LIGHTSYNC SWITCH (920-009322),$125.00 - S/481.25
"COMBO 2 EN UNO - TECLADO+MOUSE - GAMBYTE GAMER MECANICO ONESHOT, SWIT (GI-ONESHOT-MR)",$74.00 - S/284.90
"COMBO 2 EN UNO - TECLADO+MOUSE - OZONE SEMI-MECANICO DOUBLETAP | LED- RGB (OZDOUBLETAPSP)",$52.00 - S/200.20
"COMBO 2 EN UNO - TECLADO+MOUSE - GAMBYTE MECANICO GAMER BRAGI ,SWITCH ROJO (GI-BRAGI-H)",$52.00 - S/200.20
"TECLADO LOGITECH GAMER MECANICO G413 TKL, RETROILUMINACIÓN BLANCA POR TECLA, CUBIERTA SUPERIOR...",$68.00 - S/261.80
"TECLADO VSG GAMER ALNITAK NEGRO, CON ILUMINACION RGB LED, SWITCH BLUE (VG-KM982-BLK-BLU)",$50.00 - S/192.50
"TECLADO LOGITECH INALAMBRICO K480 MULTI - DEVICE, BLUETOOTH, INDICADOR LUMINOSO LED DE CARGA (9...",$57.00 - S/219.45
TECLADO CYBERTEL GAMER MECANICO EXPLORER (CYB EXPLORER),$21.00 - S/80.85
"TECLADO HYPERX GAMER MECANICO ALLOY ORIGINS 60, RETROILUMINACIÓN DEL TECLADADO RGB, CONEXION U...",$84.00 - S/323.40
COMBO 2 EN UNO - TECLADO+MOUSE - LOGITECH INALAMBRICO MK345 - (920-007820),$33.50 - S/128.98
TECLADO LOGITECH GAMING MECANICO G815 RGB LIGHTSYNC LED- RGB (920-008984),$165.00 - S/635.25
"TECLADO HALION GAMER MECANICO SPECTREC KG 927, CONEXION USB, SWITCH AZUL C/LUZ RGB (HA-KG 927)...",$42.00 - S/161.70
"TECLADO RAZER GAMER CYNOSA LITE-ESSENTIAL MEMBRANA, US , CON ILUMINACION LED RGB (RZ03-02740700...",$39.00 - S/150.15
"TECLADO MICRONICS GAMER MECANICO LEGACY, CON RETROILUMINACIÓN LED RGB, BORDE CON ILUMINACIÓN ...",$44.00 - S/169.40
COMBO 2 EN UNO - TECLADO+MOUSE - GENIUS KM-160 (31330001414),$13.00 - S/50.05
"TECLADO 1STPLAYER GAMER FIRE DANCING, DISEÑO ERGONÓMICO, CONEXION USB, EFECTOS LED (K5)",$40.00 - S/154.00
COMBO 2 EN UNO - TECLADO+MOUSE - LOGITECH INALAMBRICO MK540 (920-008673),$40.50 - S/155.93
SET DE TECLADO VSG STARDUST SATURN ORANGE DOBLE INYECCION (VG-KC207-ORG),$20.00 - S/77.00
"TECLADO DEEP COOL GAMER KG722 65%, RETROILUMINACIÓN RGB POR TECLA, CONEXION USB (R-KG722-BK0AN...",$73.00 - S/281.05
"TECLADO ENKORE GAMER MECANICO FALCON, ILUMINACIÓN ARCOIRIS 6 COLORES LED, 9 EFECTOS DE ILUMINA...",$22.50 - S/86.63
"TECLADO COUGAR GAMER VANTAR AX BLACK, VARIEDAD DE EFECTOS DE LUZ RGB LED, MARCO DE ALUMINIO, CO...",$45.00 - S/173.25
"TECLADO HALION ESTANDAR MULTIMEDIA, ALAMBRICO K334, CONEXION USB, COLOR NEGRO(MOD. HA-K334)...",$7.50 - S/28.88
"TECLADO COOLER MASTER GAMER MECANICO SK630, RETROILUMINACION DE COLERES RGB LED, TECLAS EXTRAPL...",$125.00 - S/481.25
COMBO 5 EN UNO - TECLADO+MOUSE+AURICULAR+PAD MOUSE+PARLANTE - HALION GAMING RACER (HA-830C)...,$36.00 - S/138.60
TECLADO LOGITECH GAMING MECANICO G413 BLACKLIGHT BLACK (920-010433),$76.00 - S/292.60
SET DE TECLADO VSG STARDUST KEPLER BLUE DOBLE INYECCION (VG-KC207-BLUE),$20.00 - S/77.00
SET DE TECLADO VSG STARDUST MARS RED DOBLE INYECCION (VG-KC207-RED),$20.00 - S/77.00
SET DE TECLADO VSG STARDUST METEORO BLACK DOBLE INYECCION (VG-KC207-BLK),$20.00 - S/77.00
SET DE TECLADO VSG STARDUST QUARKTASTIC GREEN DOBLE INYECCION (VG-KC207-GRN),$20.00 - S/77.00
"TECLADO VSG GAMER 60% MECANICO MINTAKA, CON ILUMINACION RGB LED, BLANCO, SWITCH BLUE (VG-KM981-...",$46.00 - S/177.10
COMBO 4 EN UNO - TECLADO+MOUSE+AURICULAR+PAD MOUSE - HALION GAMER HA-875C MACK (MACK HA-875C)...,$27.00 - S/103.95
COMBO 2 EN UNO - TECLADO+MOUSE - MICROSOFT WIRED 600 (3J2-00008),$20.00 - S/77.00
COMBO 2 EN UNO - TECLADO+MOUSE - HALION ESTANDAR USB (HA-K420C),$8.50 - S/32.73
"TECLADO HYPERX GAMER MECANICO ALLOY ORIGINS 60 % AQUA, TECLAS RETROILUMINADAS RGB LED CON EFECT...",$86.00 - S/331.10
COMBO 2 EN UNO - TECLADO+MOUSE - LOGITECH INALAMBRICO MK470 (920-009266),$41.00 - S/157.85
"TECLADO ZOWIE GAMER CELERITAS II, CON ILUMINACION RGB LED, SWITCH OPTICO LED - ROJO (9H.N0EAB-A...",$145.00 - S/558.25
ALMOHADILLA 1STPLAYER REPOSAMUÑECA PARA TECLADO S/ NUMERICO ( KW1),$8.00 - S/30.80
ALMOHADILLA 1STPLAYER REPOSAMUÑECA PARA TECLADO TAMAÑO COMPLETO (KW1)O,$9.00 - S/34.65
"COMBO 2 EN UNO - TECLADO+MOUSE | COOLER MASTER SEMI - MECANICO SET 111 RGB (MS-111-KKMF1-LS)...",$60.00 - S/231.00
"TECLADO LOGITECH INALAMBRICO ILUMINADO MX KEYS MINI MULTI - DEVICE, BLUETOOTH, USB (920-010476)...",$78.00 - S/300.30
"TECLADO HALION GAMER MECANICO MUSTANG, CON ILUMINACION RGB LED, SWITCH AZUL (HA-KG 940)",$38.00 - S/146.30
TECLADO LOGITECH INALAMBRICO K380 MULTI-DEVICE P/ CPU - PHONE - T (920-007562),$33.50 - S/128.98
"TECLADO LOGITECH GAMER PRO, ILUMINACIÓN RGB LED LIGHTSYNC, INTERRUPTORES GX BLUE CON CLICK PER...",$104.00 - S/400.40
"TECLADO LOGITECH INALAMBRICO ERGO K860, BLUETOOTH, TECLADO ERGONOMICO, BLACK (920-009845)",$107.00 - S/411.95
"TECLADO RAZER GAMER MECANICO BLACKWIDOW V3 TENKEYLESS, RETROILUMINACIÓN RGB LED, SWITCH GREEN ...",$90.00 - S/346.50
"TECLADO LOGITECH INALAMBRICO MX KEYS MINI MULTI - DEVICE BT PALE GREY, BLUETOOTH, CON ILUMINACI...",$101.00 - S/388.85
"COMBO 2 EN UNO - TECLADO+MOUSE - HALION BASICO - TECLA NARANJA USB | NEGRO (HA-K233C)",$10.50 - S/40.43
SET DE TECLADO VSG STARDUST EMC2 YELLOW DOBLE INYECCION (VG-KC207-YLW),$19.50 - S/75.08
SET DE TECLADO VSG STARDUST NEUTRON GREY DOBLE INYECCION (VG-KC207-GRAY),$20.00 - S/77.00
TECLADO LOGITECH INALAMBRICO K400 PLUS TV TOUCHPAD (920-007123),$33.00 - S/127.05
"TECLADO VSG GAMER ALNITAK BLANCO 80% MECANICO, CON ILUMINACION RGB LED, SWITCH BLUE (VG-KM982-W...",$52.00 - S/200.20
"TECLADO DEEP COOL GAMER KB500 TKL, SWITCH RED RGB LED ( R-KB500-BKAN4A-G)",$58.00 - S/223.30
TECLADO LOGITECH INALAMBRICO K650 SP BLACK P/ SMART TV/ BLUETOOTH (920-010910),$39.50 - S/152.08
"TECLADO HALION STANDAR, K116 ALAMBRICO, CONEXION USB, COLOR NEGRO (MOD. HA-K116)",$9.00 - S/34.65
"TECLADO LOGITECH INALAMBRICO BLUETOOTH K600 P/ SMART TV, COLOR NEGRO (920-008824)",$55.00 - S/211.75
"TECLADO RAZER GAMER INALAMBRICO BLACKWIDOW V3 MINI HYPERSPEED, CON ILUMINACION RGB LED, INTERRU...",$169.00 - S/650.65
COMBO 2 EN UNO - TECLADO+MOUSE - GAMBYTE GAMER REXAR V LED - MULTICOLOR (GI-REXARV V3.0),$29.00 - S/111.65
"TECLADO EVGA GAMER MECANICO Z15, CON ILUMINACION RGB LED, SWITCH KAIHL SPEED BRONZ (822-W1-15U...",$148.00 - S/569.80
"TECLADO LOGITECH, GAMING MECANICO AURORA COLECTION G713, CON ILUMINACION LED RGB, CONEXION USB,...",$163.00 - S/627.55
"TECLADO LOGITECH INALAMBRICO, GAMING MECANICO G715 AURORA COLECTION, CON ILUMINACION LED RGB, C...",$187.00 - S/719.95
"TECLADO LOGITECH MECANICO G PRO RGB EDICION LEAGUE OF LEGENDS, CON ILUMINACION RGB LED, AZUL (9...",$120.00 - S/462.00
"TECLADO LOGITECH GAMER MECANICO PRO, CON ILUMINACION RGB LED, SWITCH GX BLUE CLICKY (920-009388...",$89.50 - S/344.58
COMBO 2 EN UNO - TECLADO+MOUSE - ANTRYX PRECISION PS950 (ASC-PS950K-SP),$12.00 - S/46.20
"TECLADO HALION GAMER STRATOS HA K617, CON ILUMINACION RGB LED POR COMANDOS, MEMBRANA RGB (MOD. ...",$20.50 - S/78.93
"TECLADO ANTRYX GAMER MECANICO CHROME STORM MK830 TKL SWITCH BROWN, CON ILUMINACION RGB LED (AMK...",$51.00 - S/196.35
"TECLADO LOGITECH GAMER G213 PRODIGY, CON ILUMINACION RGB LED (920-008084)",$54.00 - S/207.90
"TECLADO LOGITECH INALAMBRICO K380 MULTI - DEVICE, BLUETOOTH, LED, C/BLANCO (920-009595)",$35.00 - S/134.75
"TECLADO GENIUS ALAMBRICO KB-117, CONEXION USB, COLOR NEGRO (31310016401)",$9.50 - S/36.58
"COMBO 2 EN UNO - TECLADO+MOUSE - KROM SEMI-MECANICO KALEIDO | LED- RGB (NXKROMKALEIDO)",$51.00 - S/196.35
"TECLADO LOGITECH INALAMBRICO GAMER MECANICO G915 TKL, BLANCO (920-009660)",$206.00 - S/793.10
SET DE TECLADO VSG STARDUST ESPECTRAL LILAC DOBLE INYECCION (VG-KC207-LILA),$20.00 - S/77.00
SET DE TECLADO VSG STARDUST NEPTUN BLUE DOBLE INYECCION (VG-KC207-AQM),$20.00 - S/77.00
"TECLADO VSG GAMER 60% MECANICO MINTAKA, CON ILUMINACION RGB LED, SWITCH BLUE (VG-KM981-BLK-BLU)...",$43.00 - S/165.55
TECLADO LOGITECH INALAMBRICO K780 MULTI-DEVICE P/ CPU - PHONE - T (920-008026),$62.00 - S/238.70
COMBO 4 EN UNO - TECLADO+MOUSE+AURICULAR+PAD MOUSE - HALION POSEIDON (HA-850C),$40.50 - S/155.93
"TECLADO GENIUS GAMER GX SCORPION K215, CON ILUMINACION RGB LED (1310474101)",$15.00 - S/57.75
"TECLADO LOGITECH INALAMBRICO MECANICO POP KEYS, MULTI DIVICE, CORAL - ROSA (920-010715)",$80.00 - S/308.00
"TECLADO GENIUS SMART KB -102, RESISTENTE A DERRAMES DE LIQUIDOS (31300007401)",$11.00 - S/42.35
"TECLADO RAZER GAMER SEMI - MECANICO ORNATA V2, RETROILUMINACIÓN CHROMA RGB LED (RZ03-03381000-...",$67.00 - S/257.95
TECLADO MICROSOFT INALAMBRICO ALL-IN-ONE MEDIA C/ MULTITACTIL (N9Z-00004),$39.00 - S/150.15
"TECLADO TRUST - SPILL RESISTANT CLASSICLINE, CON DISEÑO ERGONOMICO, CONEXION USB (20519-02)...",$9.00 - S/34.65
TECLADO PARA LAPTOP HP GENERICO P/15.5 (14AF),$12.50 - S/48.13
"COMBO 2 EN UNO - TECLADO+MOUSE - ANTRYX CHROME STORM GC-5100 | SWITCH BLUE | LED-RGB (AGC-5100K...",$53.00 - S/204.05
COMBO 2 EN UNO - TECLADO+MOUSE - GENIUS KM-200 (31330003401),$13.50 - S/51.98
"COMBO 2 EN UNO - TECLADO+MOUSE - ANTRYX CHROME STORM GC-5100 | SWITCH RED | LED-RGB (AGC-5100KR...",$53.00 - S/204.05
"TECLADO HYPERX GAMER MECANICO ALLOY ELITE 2, CON ILUMINACION RGB LED, SWITCH ROJO (4P5N3AI#AC8)...",$126.00 - S/485.10
COMBO 2 EN UNO - TECLADO+MOUSE - GAMBYTE GAMER REXAR V LED- MULTICOLO (GI-REXARV V1.0),$31.00 - S/119.35
COMBO 4 EN UNO - TECLADO+MOUSE+AURICULAR+PAD MOUSE - MSI ADVENTURE 202 - LED-RGB (ADVENTURE 202...,$85.50 - S/329.18
"TECLADO HALION BASICO, CON TECLAS ANTI BORRADO, CONEXION USB, COLOR NEGRO (HA-K427)",$7.50 - S/28.88
"TECLADO GALAX GAMER STEAL TH-03, CON ILUMINACION RGB LED, SWITCH BLUE (KGS0314T1MR1BBK0)",$38.00 - S/146.30
"TECLADO ANTRYX GAMER MECANICO CHROME STORM MK 750, CON ILUMINACION RGB LED, SWITCH AZUL (AMK-CS...",$45.50 - S/175.18
"TECLADO HALION ESTANDAR CON CABLE, CONECTOR USB, COLOR NEGRO (MOD. HA-K706)",$7.50 - S/28.88
"TECLADO MOTOSPEED GAMER MECANICO CK61, ILUMINACIÓN RGB LED POR TECLA, SWITCH AZUL (CK61)",$35.00 - S/134.75
"TECLADO CORSAIR INALAMBRICO GAMER MECANICO K63, SWITCH ROJO (CH-9145030-NA)",$77.00 - S/296.45
TECLADO LOGITECH MX KEYS INALAMBRICO CARGA DE BATERÍA (920-009296),$97.00 - S/373.45
COMBO 4 EN UNO - TECLADO+MOUSE+AURICULAR+PAD - XBLADE REAPER V2 LED - 3 & 7 COLOR (GXB-KMHP509...,$31.50 - S/121.28
"TECLADO RAZER GAMER BLACKWIDOW V3 CHROMA, RETROILUMINACIÓN RGB LED, ESTRUCTURA DE ALUMINIO, SW...",$114.00 - S/438.90
"TECLADO LOGITECH INALAMBRICO K380 MULTI - DEVICE ROSADO, P/ CPU (920-00959)",$34.00 - S/130.90
"TECLADO KROM KEMPO GAMER MECANICO, CON ILUMINACION RGB LED (NXKROMKEMPO)",$81.00 - S/311.85
"TECLADO CORSAIR GAMER MECANICO K70 RGB MK.2, CON ILUMINACION RGB LED, 100% ANTI - GHOSTING, BLA...",$131.50 - S/506.28
"TECLADO HYPERX GAMER MECANICO ALLOY ORIGINS CORE, RETROILUMINACIÓN RGB LED, ILUMINACIÓN RGB D...",$95.00 - S/365.75
COMBO 2 EN UNO - TECLADO+MOUSE - COUGAR DEATHFIRE EX (37DF2XNMB.0009),$50.50 - S/194.43
"TECLADO VSG GAMER MECANICO ALNITAK, CON ILUMINACION RGB LED, SWITCH RED (VG-KM982)",$51.00 - S/196.35
"TECLADO IMEXX, CONECTIVIDAD ALAMBRICO, USB 2.0 (IME-20320SP)",$8.50 - S/32.73
"COMBO 2 EN UNO - TECLADO+MOUSE, ARGOMTECH CONEXION USB, COLOR NEGRO (ARG-KB-7418)",$11.50 - S/44.28
"TECLADO LOGITECH INALAMBRICO GAMING MECANICO G915 TKL | LED- RG (920-009495)",$207.00 - S/796.95
SET DE TECLADO VSG STARDUST ESTELAR WHITE DOBLE INYECCION (VG-KC207-WHT),$20.00 - S/77.00
"COMBO 2 EN UNO - TECLADO+MOUSE - 1STPLAYER OFFICE KIT KM2, CONEXION USB, COLOR NEGRO (KM2)",$13.50 - S/51.98
"COMBO 2 EN UNO - TECLADO+MOUSE, HALION CONEXION USB, COLOR NEGRO (HA-K429C)",$14.00 - S/53.90
"TECLADO VSG GAMING - ALNITAK BLANCO | 80% MECANICO | SWITCH ROJO | LED - RGB (VG-KM982 BLK-BLU)...",$51.00 - S/196.35
"TECLADO LOGITECH GAMER MECANICO G410 ATLAS SPECTRUM, CON ILUMINACION RGB LED (920-007731)",$136.00 - S/523.60
COMBO 3 EN UNO - AURICULAR+WEB CAM 720 PI+TECLADO+MOUSE - TRUS HOME OFFICE ( TRUS-24042 ),$39.00 - S/150.15
"TECLADO GAMEMAX GAMER MECANICO, CON ILUMINACION RGB LED, CARCASA DE ALUMINIO, SWITCH BLUE (KG90...",$42.50 - S/163.63
COMBO 2 EN UNO - TECLADO+MOUSE - TEROS INALAMBRICO (TE-4031N),$13.00 - S/50.05
"TECLADO EVGA GAMER Z12, CON ILUMINACION RGB LED, RESISTENTE A DERRAMES, MEMBRANA USB (834-W0-12...",$46.50 - S/179.03
"TECLADO LOGITECH INALAMBRICO MECANICO POP KEYS, MULTI DIVICE, BLACK -YELLOW (920-010713)",$84.00 - S/323.40
"PAD MOUSE DEEP COOL GAMING | P/ TECLADO+MOUSE (DP-MP-DPAD-001)",$25.00 - S/96.25